Paper-like section,Paper-like section_translation,Text_original,Text,Language Speaker Reviewed,Clinical Language Speaker Reviewed
Title,T√≠tulo,ISARIC CORE CRF,Base de datos de recursos b√°sicos de ISARIC,,
DESIGN OF THIS CASE REPORT FORM (CRF),DISE√ëO DE ESTE FORMULARIO DE INFORME DE CASO (CRF),This CRF is set up in modules to be used for recording data on [PROJECT_NAME].  A template for completion instructions is below. This should be tailored to the objectives of your data collection.,Este CRF est√° configurado en m√≥dulos que se utilizar√°n para registrar datos sobre [PROJECT_NAME]. A continuaci√≥n se incluye una plantilla con instrucciones para completar el formulario. Esta plantilla debe adaptarse a los objetivos de la recopilaci√≥n de datos.,,
PRESENTATION FORM,FORMULARIO DE PRESENTACI√ìN, ALWAYS complete on the first day of presentation/admission/assessment. ,SIEMPRE completar el primer d√≠a de presentaci√≥n/admisi√≥n/evaluaci√≥n.,,
PRESENTATION FORM,FORMULARIO DE PRESENTACI√ìN,Timing /Events: Hospital admission / initial assessment,Momento/Eventos: Ingreso al hospital/evaluaci√≥n inicial,,
DAILY FORM,FORMULARIO DIARIO, ALWAYS complete on the first day of presentation/admission/assessment,SIEMPRE completar el primer d√≠a de presentaci√≥n/admisi√≥n/evaluaci√≥n,,
DAILY FORM,FORMULARIO DIARIO," IF APPLICABLE, complete on the day of admission to ICU/high dependency unit/critical care (if different date to the date of first presentation/admission)","SI CORRESPONDE, completar el d√≠a del ingreso a la UCI/unidad de alta dependencia/cuidados cr√≠ticos (si la fecha es diferente a la fecha de la primera presentaci√≥n/ingreso)",,
DAILY FORM,FORMULARIO DIARIO, OPTION to complete on days that research specific samples are taken,OPCI√ìN para completar en d√≠as en que se toman muestras espec√≠ficas de investigaci√≥n,,
DAILY FORM,FORMULARIO DIARIO, OPTION to complete daily if of interest for specific analysis. ,OPCI√ìN para completar diariamente si es de inter√©s para un an√°lisis espec√≠fico.,,
DAILY FORM,FORMULARIO DIARIO,Timing /Events: Hospital admission / initial assessment | Admission to ICU (if applicable) | Research sample taken (optional) | As per site protocol (optional),Momento/eventos: ingreso al hospital/evaluaci√≥n inicial | ingreso a la UCI (si corresponde) | toma de muestra para investigaci√≥n (opcional) | seg√∫n el protocolo del sitio (opcional),,
OUTCOME FORM,FORMULARIO DE RESULTADOS, ALWAYS complete at discharge or death or at the end of the study period,SIEMPRE completar en el momento del alta o fallecimiento o al final del per√≠odo de estudio,,
OUTCOME FORM,FORMULARIO DE RESULTADOS,Timing /Events: Discharge / death / end of study,Momento/acontecimientos: alta/muerte/fin del estudio,,
FOLLOW-UP FORM,FORMULARIO DE SEGUIMIENTO,Timing /Events: As per site protocol (optional),Horarios/Eventos: Seg√∫n protocolo del sitio (opcional),,
WITHDRAWAL FORM,FORMULARIO DE DESISTIMIENTO,Timing /Events: As per site protocol (optional),Horarios/Eventos: Seg√∫n protocolo del sitio (opcional),,
Follow-up details,Detalles de seguimiento,Continue to follow-up patients who transfer between wards.,Continuar con el seguimiento de los pacientes que se trasladan entre salas.,,
Timing /Events,Tiempo/Eventos,Hospital admission / initial assessment | Admission to ICU (if applicable) | Research sample taken (optional) | As per site protocol (optional) | Discharge / death / end of study,Admisi√≥n al hospital/evaluaci√≥n inicial | Admisi√≥n a la UCI (si corresponde) | Toma de muestra para investigaci√≥n (opcional) | Seg√∫n el protocolo del sitio (opcional) | Alta/muerte/fin del estudio,,
GENERAL GUIDANCE,ORIENTACI√ìN GENERAL,Contact ISARIC Global Support Centre at data@isaric.org,Comun√≠quese con el Centro de soporte global de ISARIC en data@isaric.org,,
GENERAL GUIDANCE,ORIENTACI√ìN GENERAL,"The CRF is designed to collect data obtained through examination, interview, review of hospital notes, or extraction from electronic health records.  Data may be collected prospectively or retrospectively if the patient is enrolled after the date of presentation to a health facility. ","El CRF est√° dise√±ado para recopilar datos obtenidos a trav√©s de ex√°menes, entrevistas, revisi√≥n de notas del hospital o extracci√≥n de registros m√©dicos electr√≥nicos. Los datos pueden recopilarse de forma prospectiva o retrospectiva si el paciente se inscribe despu√©s de la fecha de presentaci√≥n en un centro de salud.",,
GENERAL GUIDANCE,ORIENTACI√ìN GENERAL,Please refer to the CRF Completion Guideline for detailed guidance on how to complete these forms.,Consulte la Gu√≠a de finalizaci√≥n del CRF para obtener instrucciones detalladas sobre c√≥mo completar estos formularios.,,
GENERAL GUIDANCE,ORIENTACI√ìN GENERAL,"Your institution may capture data: <br/>(a) on the ISARIC hosted REDCap database - contact ISARIC for access, <br/>(b) to a REDCap database hosted at your institution - contact ISARIC if you would like support to set this up, or<br/>(c) on a database or electronic health record system at your institution - contact ISARIC to support data mapping.  ","Su instituci√≥n puede capturar datos: <br/>(a) en la base de datos REDCap alojada en ISARIC: comun√≠quese con ISARIC para obtener acceso, <br/>(b) en una base de datos REDCap alojada en su instituci√≥n: comun√≠quese con ISARIC si desea recibir ayuda para configurarla, o<br/>(c) en una base de datos o sistema de registro m√©dico electr√≥nico en su instituci√≥n: comun√≠quese con ISARIC para obtener ayuda con el mapeo de datos.",,
GENERAL GUIDANCE,ORIENTACI√ìN GENERAL,"Participant Identification Numbers consist of a 5-digit site code and a 4-digit participant number. <br/>Please obtain a site code and register on the data management system by contacting ISARIC.  Participant numbers should be assigned sequentially for each site beginning with 0001 or in blocks, possibly including alpha characters, where useful.  E.g., Ward X will assign numbers from 0001 or A001 onwards and Ward Y will assign numbers from 5001 or B001 onwards.","Los n√∫meros de identificaci√≥n de los participantes consisten en un c√≥digo de sitio de 5 d√≠gitos y un n√∫mero de participante de 4 d√≠gitos. <br/>Obtenga un c√≥digo de sitio y reg√≠strese en el sistema de gesti√≥n de datos poni√©ndose en contacto con ISARIC. Los n√∫meros de participante deben asignarse secuencialmente para cada sitio comenzando con 0001 o en bloques, posiblemente incluyendo caracteres alfab√©ticos, cuando sea √∫til. Por ejemplo, el Distrito X asignar√° n√∫meros a partir de 0001 o A001 en adelante y el Distrito Y asignar√° n√∫meros a partir de 5001 o B001 en adelante.",,
GENERAL GUIDANCE,ORIENTACI√ìN GENERAL,"For participants who return for re-admission to the same site, start a new form with a different Participant Identification Number. Please check ""YES-admitted previously to this facility"" in the RE-ADMISSION section. Enter as 2 separate records if you are using a REDCap (or similar) database. ","Para los participantes que regresan para ser readmitidos al mismo sitio, comience un nuevo formulario con un N√∫mero de identificaci√≥n de participante diferente. Marque ""S√ç, admitido previamente en este centro"" en la secci√≥n READMISI√ìN. Ingrese como 2 registros separados si est√° utilizando una base de datos REDCap (o similar).",,
GENERAL GUIDANCE,ORIENTACI√ìN GENERAL,"For participants who transfer between two sites that are both collecting data on this form, it is preferred to have the data entered by a single site as a single admission, under the same Participant Identification Number. When this is not possible, the first site should record ""Transfer to other facility"" as an OUTCOME, and the second site should start a new form with a new patient number and indicate ""YES-Ö then transferred to this facility"" in the RE-ADMISSION AND PREVIOUS PIN section. ","En el caso de los participantes que se trasladan entre dos centros en los que se recopilan datos en este formulario, es preferible que los datos se ingresen en un solo centro como una sola admisi√≥n, con el mismo n√∫mero de identificaci√≥n del participante. Cuando esto no sea posible, el primer centro debe registrar ""Transferencia a otro centro"" como RESULTADO, y el segundo centro debe iniciar un nuevo formulario con un nuevo n√∫mero de paciente e indicar ""S√ç... luego transferido a este centro"" en la secci√≥n READMISI√ìN Y PIN ANTERIOR.",,
GENERAL GUIDANCE,ORIENTACI√ìN GENERAL,Selections with circles () are single selection (choose one answer only). Selections with square boxes () are multiple selection (choose as many answers as are applicable). Unk = Unknown,Las selecciones con c√≠rculos () son de selecci√≥n √∫nica (elige solo una respuesta). Las selecciones con recuadros () son de selecci√≥n m√∫ltiple (elige tantas respuestas como corresponda). Unk = Desconocido,,
